{
  "schemaVersion": 1,
  "id": "accf_provenance",
  "procedureId": "accf",
  "contentRevision": 1,
  "englishSource": {
    "path": "web/src/content/procedureText.js",
    "sha256": "cd49d3bbaa3a2ff9ec26368509f72bae1036f077f831a77e54a6fcbdcca4cc00",
    "migration": "mechanical-html-to-restricted-markdown",
    "normalizations": []
  },
  "translationReview": {
    "status": "editorialReviewed",
    "reviewer": "Codex bilingual editorial pass",
    "reviewedAt": "2026-08-02"
  },
  "medicalReview": {
    "status": "ownerApproved",
    "releaseGate": false
  },
  "rightsReview": {
    "status": "ownerApproved",
    "releaseGate": false
  },
  "assetSource": {
    "path": "web/public/Anterior Cervical Corpectomy and Fusion (ACCF) Light.glb",
    "sha256": "ab13b22ffabca7153e456b13cdd751bfbbe964f17ef70905c44ea6de29fb9af6"
  },
  "license": "Repository-controlled educational asset",
  "authors": [
    "The Commissure contributors"
  ]
}
