{
  "schemaVersion": 1,
  "id": "pcf_provenance",
  "procedureId": "pcf",
  "contentRevision": 1,
  "englishSource": {
    "path": "web/src/content/procedureText.js",
    "sha256": "cd49d3bbaa3a2ff9ec26368509f72bae1036f077f831a77e54a6fcbdcca4cc00",
    "migration": "mechanical-html-to-restricted-markdown",
    "normalizations": [
      {
        "from": "pressure on spine cord",
        "to": "pressure on the spinal cord",
        "reason": "terminologyCorrection"
      },
      {
        "from": "posterior cervical discectomy and fusion (PCDF)",
        "to": "posterior cervical decompression and fusion (PCDF)",
        "reason": "terminologyCorrection"
      },
      {
        "from": "anterior cervical discectomy (ACDF)",
        "to": "anterior cervical discectomy and fusion (ACDF)",
        "reason": "terminologyCorrection"
      }
    ]
  },
  "translationReview": {
    "status": "editorialReviewed",
    "reviewer": "Codex bilingual editorial pass",
    "reviewedAt": "2026-08-02"
  },
  "medicalReview": {
    "status": "inheritedWebsiteSource",
    "releaseGate": true
  },
  "rightsReview": {
    "status": "ownerApproved",
    "releaseGate": false
  },
  "assetSource": {
    "path": "web/public/Posterior Cervical Foraminotomy (PCF) Light.glb",
    "sha256": "f292255dafe7646ce48014f71555f05587ea0f0791a2dc9e4ff75d2fbd0ae403"
  },
  "license": "Repository-controlled educational asset",
  "authors": [
    "The Commissure contributors"
  ]
}
