{
  "schemaVersion": 1,
  "id": "pcdf_provenance",
  "procedureId": "pcdf",
  "contentRevision": 1,
  "englishSource": {
    "path": "web/src/content/procedureText.js",
    "sha256": "cd49d3bbaa3a2ff9ec26368509f72bae1036f077f831a77e54a6fcbdcca4cc00",
    "migration": "mechanical-html-to-restricted-markdown",
    "normalizations": []
  },
  "translationReview": {
    "status": "editorialReviewed",
    "reviewer": "Codex bilingual editorial pass",
    "reviewedAt": "2026-08-02"
  },
  "medicalReview": {
    "status": "ownerApproved",
    "releaseGate": false
  },
  "rightsReview": {
    "status": "ownerApproved",
    "releaseGate": false
  },
  "assetSource": {
    "path": "web/public/Posterior Cervical Decompression and Fusion (PCDF) Light.glb",
    "sha256": "d8d57774af3e59cdbfccf2636f6b4ab3f8934e0c48c542086684935cc3eedff9"
  },
  "license": "Repository-controlled educational asset",
  "authors": [
    "The Commissure contributors"
  ]
}
