{
  "schemaVersion": 1,
  "id": "acdf_provenance",
  "procedureId": "acdf",
  "contentRevision": 1,
  "englishSource": {
    "path": "web/src/content/procedureText.js",
    "sha256": "cd49d3bbaa3a2ff9ec26368509f72bae1036f077f831a77e54a6fcbdcca4cc00",
    "migration": "mechanical-html-to-restricted-markdown",
    "normalizations": []
  },
  "translationReview": {
    "status": "editorialReviewed",
    "reviewer": "Codex bilingual editorial pass",
    "reviewedAt": "2026-08-02"
  },
  "medicalReview": {
    "status": "inheritedWebsiteSource",
    "releaseGate": true
  },
  "rightsReview": {
    "status": "ownerApproved",
    "releaseGate": false
  },
  "assetSource": {
    "path": "web/public/Anterior Cervical Discectomy and Fusion (ACDF) Light.glb",
    "sha256": "15b1254d853a8ca7d96c27299b212bea531359cf1c45ddaab6fdd31a704b6426"
  },
  "license": "Repository-controlled educational asset",
  "authors": [
    "The Commissure contributors"
  ]
}
